{
  "id": "ui:prumo-code-shell",
  "version": 1,
  "surface": "Prumo Code TUI \u2014 app shell and run panel (H10 spike)",
  "note": "ARCHIVED. Interface map of the from-scratch H10 terminal client, kept beside the artifact it describes: the client was archived to `archive/tui/` and its strategy replaced by ADR 013, which builds the shipping client on the archived OpenCode Go view layer. No gate reads this file — `prumo ui verify` compiles the canonical map at `docs/ui-ux/interface-map.json`, which describes the shipping client. It is kept because a map that travels with its code is the only way to read the archived client's structure, and because deleting it would leave the archive undescribed.",
  "platforms": [
    "tui"
  ],
  "states_source": "docs/ui-ux/state-matrix.json",
  "tokens_source": "docs/ui-ux/design-tokens.json",
  "derivation": {
    "sources": [
      "archive/tui/**/*.go"
    ],
    "mode": "verify-only"
  },
  "tree": [
    {
      "id": "node:shell",
      "kind": "shell",
      "role": "Application root: one stage at a time, palette-first navigation",
      "slot": {
        "region": "root",
        "order": 0,
        "align": "stretch",
        "stack": "column"
      },
      "size_classes": [
        "compact",
        "standard",
        "wide"
      ],
      "states": [
        "default",
        "focus",
        "high-contrast"
      ],
      "tokens": [
        "token:color.surface"
      ],
      "implementation": {
        "symbol": "tui.Model",
        "path": "tui/app.go",
        "status": "implemented"
      },
      "children": [
        {
          "id": "node:titlebar",
          "kind": "region",
          "role": "Product identity line, shared by every stage",
          "slot": {
            "region": "header",
            "order": 0,
            "align": "start"
          },
          "size_classes": [
            "compact",
            "standard",
            "wide"
          ],
          "tokens": [
            "token:color.text"
          ],
          "children": [
            {
              "id": "node:titlebar-text",
              "kind": "text",
              "label": "Prumo",
              "role": "Names the product; the only brand surface in the client",
              "slot": {
                "region": "header",
                "order": 0,
                "align": "start"
              },
              "size_classes": [
                "compact",
                "standard",
                "wide"
              ],
              "states": [
                "default",
                "high-contrast"
              ],
              "tokens": [
                "token:color.text"
              ],
              "implementation": {
                "symbol": "tui.Model.View",
                "path": "tui/app.go",
                "status": "implemented"
              }
            }
          ]
        },
        {
          "id": "node:body",
          "kind": "region",
          "role": "Stage area: exactly one stage owns the keyboard",
          "slot": {
            "region": "body",
            "order": 1,
            "align": "stretch",
            "weight": 1,
            "stack": "column"
          },
          "size_classes": [
            "compact",
            "standard",
            "wide"
          ],
          "children": [
            {
              "id": "node:palette",
              "kind": "pane",
              "label": "Command palette",
              "role": "Palette-first entry point: every action is reachable from here",
              "intent": "Let a user act without having to know which pane a feature lives in",
              "slot": {
                "region": "body",
                "order": 0,
                "align": "stretch",
                "stack": "row",
                "condition": "stage = palette"
              },
              "size_classes": [
                "compact",
                "standard",
                "wide"
              ],
              "states": [
                "default",
                "focus",
                "empty",
                "loading"
              ],
              "tokens": [
                "token:tui.command-palette.highlight",
                "token:color.text-muted"
              ],
              "inputs": [
                "down",
                "up",
                "ctrl+p",
                "ctrl+n",
                "enter",
                "esc"
              ],
              "implementation": {
                "symbol": "tui.Palette",
                "path": "tui/palette.go",
                "status": "implemented"
              },
              "children": [
                {
                  "id": "node:palette-list",
                  "kind": "list",
                  "label": "Ranked commands",
                  "role": "Ranked matches for the current query, best first",
                  "slot": {
                    "region": "body",
                    "order": 0,
                    "align": "stretch",
                    "stack": "column"
                  },
                  "size_classes": [
                    "compact",
                    "standard",
                    "wide"
                  ],
                  "states": [
                    "default",
                    "focus",
                    "selected",
                    "empty",
                    "narrow-viewport"
                  ],
                  "tokens": [
                    "token:tui.command-palette.highlight"
                  ],
                  "inputs": [
                    "down",
                    "up"
                  ],
                  "implementation": {
                    "symbol": "tui.Palette.Matches",
                    "path": "tui/palette.go",
                    "status": "implemented"
                  },
                  "children": [
                    {
                      "id": "node:palette-row",
                      "kind": "button",
                      "label": "\u203a <command title>",
                      "role": "One selectable command; the selected row also shows its description",
                      "intent": "Make the highlighted action the obvious one to accept",
                      "slot": {
                        "region": "body",
                        "order": 0,
                        "align": "start"
                      },
                      "size_classes": [
                        "compact",
                        "standard",
                        "wide"
                      ],
                      "states": [
                        "default",
                        "focus",
                        "selected"
                      ],
                      "tokens": [
                        "token:tui.command-palette.highlight",
                        "token:color.text"
                      ],
                      "inputs": [
                        "enter",
                        "pointer"
                      ],
                      "implementation": {
                        "symbol": "tui.Command",
                        "path": "tui/palette.go",
                        "status": "implemented"
                      }
                    },
                    {
                      "id": "node:palette-empty",
                      "kind": "text",
                      "label": "no command matches \"<query>\"",
                      "role": "States the empty filter result instead of rendering a blank panel",
                      "intent": "A blank panel reads as a broken palette; the message says the query is the reason",
                      "slot": {
                        "region": "body",
                        "order": 1,
                        "align": "start"
                      },
                      "size_classes": [
                        "compact",
                        "standard",
                        "wide"
                      ],
                      "states": [
                        "empty"
                      ],
                      "tokens": [
                        "token:color.text-muted"
                      ],
                      "implementation": {
                        "symbol": "tui.Palette.Empty",
                        "path": "tui/palette.go",
                        "status": "implemented"
                      }
                    },
                    {
                      "id": "node:palette-query",
                      "kind": "input",
                      "label": "query: <text>",
                      "role": "The fuzzy filter, shown as text rather than stored invisibly",
                      "slot": {
                        "region": "body",
                        "order": 2,
                        "align": "start"
                      },
                      "size_classes": [
                        "compact",
                        "standard",
                        "wide"
                      ],
                      "states": [
                        "default",
                        "focus",
                        "read-only"
                      ],
                      "tokens": [
                        "token:color.text-muted"
                      ],
                      "inputs": [
                        "paste"
                      ],
                      "implementation": {
                        "symbol": "tui.Palette.SetQuery",
                        "path": "tui/palette.go",
                        "status": "implemented"
                      }
                    }
                  ]
                }
              ]
            },
            {
              "id": "node:goal-prompt",
              "kind": "pane",
              "label": "Goal prompt",
              "role": "Collects the goal text before a run starts",
              "intent": "One field, one decision: what should the agent do",